{
  "$schema": "https://json-schema.org/draft/2020-12/schema",
  "$id": "https://elitemay.github.io/web-project-guide/maintenance/loop-policy.schema.json",
  "title": "Web Project Guide Loop Policy",
  "type": "object",
  "additionalProperties": false,
  "required": [
    "policyVersion",
    "loopId",
    "repository",
    "goal",
    "scope",
    "trigger",
    "verification",
    "budget",
    "permissions",
    "progress",
    "stop"
  ],
  "properties": {
    "policyVersion": {
      "type": "string",
      "const": "1"
    },
    "loopId": {
      "type": "string",
      "minLength": 1,
      "maxLength": 128,
      "pattern": "^[A-Za-z0-9._-]+$"
    },
    "repository": {
      "type": "string",
      "pattern": "^[^/\\s]+/[^/\\s]+$"
    },
    "autonomyLevel": {
      "type": "string",
      "enum": [
        "L0_ASSISTED",
        "L1_WORKTREE",
        "L2_PR",
        "L3_GUARDED_MERGE",
        "L4_GUARDED_RELEASE"
      ],
      "default": "L1_WORKTREE"
    },
    "goal": {
      "type": "object",
      "additionalProperties": false,
      "required": ["statement", "completionCriteria"],
      "properties": {
        "statement": {
          "type": "string",
          "minLength": 1
        },
        "completionCriteria": {
          "type": "array",
          "minItems": 1,
          "items": {
            "type": "string",
            "minLength": 1
          }
        }
      }
    },
    "scope": {
      "type": "object",
      "additionalProperties": false,
      "required": ["workingBranchPolicy", "allowedPaths", "protectedPaths"],
      "properties": {
        "workingBranchPolicy": {
          "type": "string",
          "enum": ["isolated_branch", "isolated_worktree", "read_only"]
        },
        "allowedPaths": {
          "type": "array",
          "minItems": 1,
          "items": {
            "type": "string",
            "minLength": 1
          }
        },
        "protectedPaths": {
          "type": "array",
          "items": {
            "type": "string",
            "minLength": 1
          }
        },
        "requiredSources": {
          "type": "array",
          "items": {
            "type": "string",
            "minLength": 1
          }
        }
      }
    },
    "trigger": {
      "type": "object",
      "additionalProperties": false,
      "required": ["type"],
      "properties": {
        "type": {
          "type": "string",
          "enum": ["manual", "queue", "schedule", "event"]
        },
        "source": {
          "type": "string"
        }
      }
    },
    "verification": {
      "type": "object",
      "additionalProperties": false,
      "required": ["minimumLevel", "protected", "requiredChecks"],
      "properties": {
        "minimumLevel": {
          "type": "string",
          "enum": [
            "V0_SELF",
            "V1_STATIC",
            "V2_DETERMINISTIC",
            "V3_RUNTIME",
            "V4_PROTECTED",
            "V5_HUMAN"
          ]
        },
        "protected": {
          "type": "boolean"
        },
        "requiredChecks": {
          "type": "array",
          "minItems": 1,
          "items": {
            "type": "string",
            "minLength": 1
          }
        },
        "evidenceRequired": {
          "type": "boolean",
          "default": true
        },
        "allowWorkerToModifyVerifier": {
          "type": "boolean",
          "default": false
        }
      }
    },
    "budget": {
      "type": "object",
      "additionalProperties": false,
      "required": ["maxIterations", "maxSameFailure", "maxParallelWorkers"],
      "properties": {
        "maxIterations": {
          "type": "integer",
          "minimum": 1,
          "maximum": 1000
        },
        "maxSameFailure": {
          "type": "integer",
          "minimum": 1,
          "maximum": 100
        },
        "maxParallelWorkers": {
          "type": "integer",
          "minimum": 1,
          "maximum": 64
        },
        "maxWallClockMinutes": {
          "type": ["integer", "null"],
          "minimum": 1
        },
        "maxModelTokens": {
          "type": ["integer", "null"],
          "minimum": 1
        },
        "maxExternalCost": {
          "type": ["number", "null"],
          "minimum": 0
        },
        "costCurrency": {
          "type": ["string", "null"],
          "minLength": 3,
          "maxLength": 3
        }
      }
    },
    "permissions": {
      "type": "object",
      "additionalProperties": false,
      "required": [
        "repositoryRead",
        "workingBranchWrite",
        "commit",
        "pushWorkingBranch",
        "defaultBranchWrite",
        "merge",
        "deploy",
        "externalNetwork",
        "secretAccess"
      ],
      "properties": {
        "repositoryRead": {"type": "boolean"},
        "workingBranchWrite": {"type": "boolean"},
        "commit": {"type": "boolean"},
        "pushWorkingBranch": {"type": "boolean"},
        "defaultBranchWrite": {"type": "boolean"},
        "merge": {"type": "boolean"},
        "deploy": {"type": "boolean"},
        "externalNetwork": {"type": "boolean"},
        "secretAccess": {"type": "boolean"}
      }
    },
    "progress": {
      "type": "object",
      "additionalProperties": false,
      "required": ["detectSameFailure", "requireMeaningfulDelta"],
      "properties": {
        "detectSameFailure": {"type": "boolean"},
        "requireMeaningfulDelta": {"type": "boolean"},
        "signatureInputs": {
          "type": "array",
          "items": {
            "type": "string",
            "enum": [
              "error_category",
              "normalized_message",
              "failing_checks",
              "affected_area",
              "blocker"
            ]
          },
          "uniqueItems": true
        }
      }
    },
    "stop": {
      "type": "object",
      "additionalProperties": false,
      "required": ["successWhen", "escalateWhen", "terminalStates"],
      "properties": {
        "successWhen": {
          "type": "array",
          "minItems": 1,
          "items": {
            "type": "string",
            "minLength": 1
          }
        },
        "escalateWhen": {
          "type": "array",
          "minItems": 1,
          "items": {
            "type": "string",
            "enum": [
              "user_decision_required",
              "irreversible_destructive_action",
              "external_permission_required",
              "billing_required",
              "secret_access_required",
              "material_requirements_conflict",
              "verifier_uncertain",
              "scope_expansion_required",
              "production_release_gate"
            ]
          },
          "uniqueItems": true
        },
        "terminalStates": {
          "type": "array",
          "minItems": 8,
          "uniqueItems": true,
          "items": {
            "type": "string",
            "enum": [
              "passed",
              "failed",
              "stuck",
              "blocked",
              "budget_exhausted",
              "escalated",
              "cancelled",
              "needs_reconcile"
            ]
          }
        }
      }
    }
  }
}
